Title,Content,Description,URL,Source,Published Date,Image URL,Author,Language,Entities,Keywords,Chunks,Metadata
alibaba denies it has made 1 billion investment in deepseek,on feb 7 reports circulated online that alibaba was looking to invest 1 billion in deepseek to take a 10 stake valuing the ai company at 10 billion and potentially forging a strong partnership,on feb 7 reports circulated online that alibaba was looking to invest 1 billion in deepseek to take a 10 stake valuing the ai company at 10 billion and potentially forging a strong partnership between two hangzhoubased tech companies alibaba group,http://technode.com/2025/02/08/alibaba-denies-it-has-made-1-billion-investment-in-deepseek/,TechNode,2025-02-08T09:38:00Z,https://i0.wp.com/technode.com/wp-content/uploads/2023/10/%E6%88%AA%E5%B1%8F2023-10-10-%E4%B8%8B%E5%8D%883.49.21.png?fit=480%2C254&ssl=1,TechNode Feed,en,"{'Persons': [], 'Organizations': ['AI'], 'Locations': ['Alibaba']}","[('billion deepseek', 0.6047), ('deepseek', 0.5423), ('deepseek 10', 0.5385), ('invest billion', 0.4686), ('valuing ai', 0.4207)]","['On Feb. 7, reports circulated online that Alibaba was looking to invest $1 billion in DeepSeek to take a 10% stake, valuing the AI company at $10 billion and potentially forging a strong partnership … [+356 chars]']","{'Source': 'TechNode', 'Published Date': '2025-02-08T09:38:00Z', 'Keywords': [('billion deepseek', 0.6047), ('deepseek', 0.5423), ('deepseek 10', 0.5385), ('invest billion', 0.4686), ('valuing ai', 0.4207)], 'Entities': {'Persons': [], 'Organizations': ['AI'], 'Locations': ['Alibaba']}}"
apple stock jumps on artificial intelligence ai driving iphone sales heres why its not getting crushed by the deepseek launch,the news of deepseeks launch last week spread rapidly in the markets wiping out 16 of nvidias value while affecting many other artificial intelligence ai stockshowever several stocks notably,the news of deepseeks launch last week spread rapidly in the markets wiping out 16 of nvidias value while affecting many other artificial intelligence ai stocks however several stocks notably withstood the deepseek avalanche including apple nasdaq,https://biztoc.com/x/519f28455f9d8f33,Biztoc.com,2025-02-08T09:35:30Z,https://biztoc.com/cdn/808/og.png,aol.com,en,"{'Persons': [], 'Organizations': ['DeepSeek', 'AI'], 'Locations': ['Nvidia']}","[('deepseek launch', 0.6475), ('deepseek', 0.6154), ('news deepseek', 0.6028), ('ai stocks', 0.4829), ('stocks notably', 0.3955)]","[""The news of DeepSeek's launch last week spread rapidly in the markets, wiping out 16% of Nvidia's value while affecting many other artificial intelligence (AI) stocks.However, several stocks notably … [+147 chars]""]","{'Source': 'Biztoc.com', 'Published Date': '2025-02-08T09:35:30Z', 'Keywords': [('deepseek launch', 0.6475), ('deepseek', 0.6154), ('news deepseek', 0.6028), ('ai stocks', 0.4829), ('stocks notably', 0.3955)], 'Entities': {'Persons': [], 'Organizations': ['DeepSeek', 'AI'], 'Locations': ['Nvidia']}}"
apple stock jumps on artificial intelligence ai driving iphone sales heres why its not getting crushed by the deepseek launch,if you click accept all we and our partners including 239 who are part of the iab transparency amp consent framework will also store andor access information on a device in other words use,,https://consent.yahoo.com/v2/collectConsent?sessionId=1_cc-session_713cb470-d013-43f6-94ee-23b0db69939c,Yahoo Entertainment,2025-02-08T09:05:00Z,,,en,"{'Persons': ['Consent Framework'], 'Organizations': ['the IAB Transparency &'], 'Locations': []}","[('access information', 0.5177), ('iab transparency', 0.48), ('239 iab', 0.4692), ('consent framework', 0.4651), ('information device', 0.429)]","[""If you click 'Accept all', we and our partners, including 239 who are part of the IAB Transparency &amp; Consent Framework, will also store and/or access information on a device (in other words, use … [+702 chars]""]","{'Source': 'Yahoo Entertainment', 'Published Date': '2025-02-08T09:05:00Z', 'Keywords': [('access information', 0.5177), ('iab transparency', 0.48), ('239 iab', 0.4692), ('consent framework', 0.4651), ('information device', 0.429)], 'Entities': {'Persons': ['Consent Framework'], 'Organizations': ['the IAB Transparency &'], 'Locations': []}}"
stockmarket concentration rivals 1929 and 1999 levels glenmede investment management warns — setting the sp 500 up for 5 years of dismal returns,how much longer can the magnificent seven stocks continue to dominate the equity market history suggests their era of outperformance is on the verge of fading according to an analysis by glenmede,how much longer can the magnificent seven stocks continue to dominate history suggests not long,https://www.businessinsider.com/stock-market-crash-why-sp500-due-for-dismal-returns-glenmede-2025-2,Business Insider,2025-02-08T09:00:01Z,https://i.insider.com/67a667f06630eb10385bf7fe?width=792&format=jpeg,wedwards@businessinsider.com (William Edwards),en,"{'Persons': ['Glenmede'], 'Organizations': [], 'Locations': []}","[('seven stocks', 0.6125), ('stocks continue', 0.5554), ('stocks', 0.4648), ('magnificent seven', 0.4286), ('dominate equity', 0.4134)]",['How much longer can the Magnificent Seven stocks continue to dominate the equity market? History suggests their era of outperformance is on the verge of fading. According to an analysis by Glenmede … [+3601 chars]'],"{'Source': 'Business Insider', 'Published Date': '2025-02-08T09:00:01Z', 'Keywords': [('seven stocks', 0.6125), ('stocks continue', 0.5554), ('stocks', 0.4648), ('magnificent seven', 0.4286), ('dominate equity', 0.4134)], 'Entities': {'Persons': ['Glenmede'], 'Organizations': [], 'Locations': []}}"
cloudastructure inc class a common stock csai expands sales team to meet growing demand for ai security solutions,we recently compiled a list of the 10 ai news updates making waves on wall street in this article we are going to take a look at where cloudastructure inc class a common stock nasdaqcsai,we recently compiled a list of the 10 ai news updates making waves on wall street in this article we are going to take a look at where cloudastructure inc,https://finance.yahoo.com/news/cloudastructure-inc-class-common-stock-072419300.html,Yahoo Entertainment,2025-02-08T07:24:19Z,https://s.yimg.com/ny/api/res/1.2/jES.4QWlDHc9sIS36lXM2g--/YXBwaWQ9aGlnaGxhbmRlcjt3PTEyMDA7aD02NzM-/https://media.zenfs.com/en/insidermonkey.com/98ce5b257a2e848e21ffb1e42a1541ab,Affan Mir,en,"{'Persons': [], 'Organizations': ['Cloudastructure, Inc.'], 'Locations': []}","[('nasdaq csai', 0.5572), ('stock nasdaq', 0.5526), ('cloudastructure', 0.5204), ('nasdaq', 0.5068), ('ai news', 0.4957)]","['We recently compiled a list of the 10 AI News Updates Making Waves on Wall Street. In this article, we are going to take a look at where Cloudastructure, Inc. Class A Common Stock (NASDAQ:CSAI) stand… [+4626 chars]']","{'Source': 'Yahoo Entertainment', 'Published Date': '2025-02-08T07:24:19Z', 'Keywords': [('nasdaq csai', 0.5572), ('stock nasdaq', 0.5526), ('cloudastructure', 0.5204), ('nasdaq', 0.5068), ('ai news', 0.4957)], 'Entities': {'Persons': [], 'Organizations': ['Cloudastructure, Inc.'], 'Locations': []}}"
how apple could work with deepseek to pull ahead in the ai race,ever since deepseek burst onto the scene last month theres been no shortage of opinions about what the chinese startups artificial intelligence accomplishments mean for americas ai giants like,ever since deepseek burst onto the scene last month there’s been no shortage of opinions about what the chinese startup’s artificial intelligence accomplishments mean for america’s ai giants like openai microsoft google and meta however there’s one,https://www.fastcompany.com/91273725/deepseek-benefit-apple-intelligence-china-ai-race-openai-google-microsoft-meta,Fast Company,2025-02-08T10:00:00Z,"https://images.fastcompany.com/image/upload/f_webp,q_auto,c_fit,w_1024,h_1024/wp-cms-2/2025/02/p-91273725-how-apple-could-work-with-deepseek.jpg",Michael Grothaus,en,"{'Persons': [], 'Organizations': [], 'Locations': ['Americas AI']}","[('ai giants', 0.501), ('deepseek', 0.4875), ('americas ai', 0.4867), ('chinese startups', 0.4839), ('deepseek burst', 0.4403)]","['Ever since DeepSeek burst onto the scene last month, theres been no shortage of opinions about what the Chinese startups artificial intelligence accomplishments mean for Americas AI giants like OpenA… [+1937 chars]']","{'Source': 'Fast Company', 'Published Date': '2025-02-08T10:00:00Z', 'Keywords': [('ai giants', 0.501), ('deepseek', 0.4875), ('americas ai', 0.4867), ('chinese startups', 0.4839), ('deepseek burst', 0.4403)], 'Entities': {'Persons': [], 'Organizations': [], 'Locations': ['Americas AI']}}"
ai expert explores finland’s role in global tech race,as the us and china compete for dominance in artificial intelligence ai finland is carving out its role by focusing on innovation tailored to its unique language and culture according to peter,silo ai founder peter sarlin highlights the importance of sovereignty innovation and education in boosting finland’s competitiveness in the sector on the world stage,https://yle.fi/a/74-20142384,YLE News,2025-02-08T09:59:57Z,"https://images.cdn.yle.fi/image/upload/c_crop,x_0,y_153,w_6000,h_3375/w_1200,ar_1.91,c_fill/q_auto:eco,f_auto,fl_lossy/v1739002816/39-141858767a712ab2e90b",,en,"{'Persons': ['Peter S'], 'Organizations': [], 'Locations': ['US', 'China', 'Finland']}","[('ai finland', 0.7197), ('finland', 0.5061), ('ai', 0.4974), ('intelligence ai', 0.4502), ('innovation', 0.4381)]","['As the US and China compete for dominance in artificial intelligence (AI), Finland is carving out its role by focusing on innovation tailored to its unique language and culture. According to Peter S… [+2846 chars]']","{'Source': 'YLE News', 'Published Date': '2025-02-08T09:59:57Z', 'Keywords': [('ai finland', 0.7197), ('finland', 0.5061), ('ai', 0.4974), ('intelligence ai', 0.4502), ('innovation', 0.4381)], 'Entities': {'Persons': ['Peter S'], 'Organizations': [], 'Locations': ['US', 'China', 'Finland']}}"
mediatek is ‘doing some simulations’ to see if it will be included in us tariffs chief executive says that this year will be ‘manageable’,technology companies based in taiwan face the possibility that newly elected us president donald trump will follow through with this plan of applying tariffs on imported chips meaning that,technology companies based in taiwan face the possibility that newly elected us president donald trump will follow through with this plan of applying tariffs on imported chips meaning that mediatek will also be included in this list this move will,https://wccftech.com/mediatek-doing-simulations-to-see-if-it-will-be-included-in-us-tariffs/,Wccftech,2025-02-08T08:03:27Z,https://cdn.wccftech.com/wp-content/uploads/2025/02/MediaTek.jpg,Omar Sohail,en,"{'Persons': ['Donald Trump', 'MediaTe'], 'Organizations': [], 'Locations': ['Taiwan', 'U.S.']}","[('applying tariffs', 0.5315), ('tariffs', 0.5207), ('tariffs imported', 0.5131), ('based taiwan', 0.4823), ('imported chips', 0.4446)]","['Technology companies based in Taiwan face the possibility that newly elected U.S. President Donald Trump will follow through with this plan of applying tariffs on imported chips, meaning that MediaTe… [+1950 chars]']","{'Source': 'Wccftech', 'Published Date': '2025-02-08T08:03:27Z', 'Keywords': [('applying tariffs', 0.5315), ('tariffs', 0.5207), ('tariffs imported', 0.5131), ('based taiwan', 0.4823), ('imported chips', 0.4446)], 'Entities': {'Persons': ['Donald Trump', 'MediaTe'], 'Organizations': [], 'Locations': ['Taiwan', 'U.S.']}}"
top startup and tech stories this week,welcome to a new edition of ettech unwrapped our weekend newsletter packed with the most important stories this week lets take a look openai ceo sam altmaninterview openai ceo sam altman on,welcome to a new edition of ettech unwrapped – our weekend newsletter packed with the most important stories this week let’s take a look,https://economictimes.indiatimes.com/tech/newsletters/ettech-unwrapped/top-startup-and-tech-stories-this-week/articleshow/118044779.cms,The Times of India,2025-02-08T01:24:16Z,"https://img.etimg.com/thumb/msid-118044779,width-1070,height-580,imgsize-37466,overlay-ettech/editionshow.jpg",ETtech,en,"{'Persons': ['OpenAI', 'Sam AltmanInterview', 'Sam Altman'], 'Organizations': [], 'Locations': ['OpenAI']}","[('openai ceo', 0.7326), ('openai', 0.5568), ('ceo sam', 0.5415), ('altman deeps', 0.5206), ('altmaninterview openai', 0.5029)]",['Welcome to a new edition of ETtech Unwrapped our weekend newsletter packed with the most important stories this week. Lets take a look. OpenAI CEO Sam AltmanInterview: OpenAI CEO Sam Altman on DeepS… [+5522 chars]'],"{'Source': 'The Times of India', 'Published Date': '2025-02-08T01:24:16Z', 'Keywords': [('openai ceo', 0.7326), ('openai', 0.5568), ('ceo sam', 0.5415), ('altman deeps', 0.5206), ('altmaninterview openai', 0.5029)], 'Entities': {'Persons': ['OpenAI', 'Sam AltmanInterview', 'Sam Altman'], 'Organizations': [], 'Locations': ['OpenAI']}}"
morgan stanley forecasts strong price appreciation for corpay nysecpay stock,corpay nysecpay – get free report had its price objective raised by research analysts at morgan stanley from 35000 to 38000 in a research report issued to clients and investors on,corpay nysecpay – get free report had its price objective raised by research analysts at morgan stanley from 35000 to 38000 in a research report issued to clients and investors on thursdaybenzinga reports the brokerage currently has an “equal,https://www.etfdailynews.com/2025/02/08/morgan-stanley-forecasts-strong-price-appreciation-for-corpay-nysecpay-stock/,ETF Daily News,2025-02-08T09:42:57Z,https://www.americanbankingnews.com/wp-content/timthumb/timthumb.php?src=https://www.marketbeat.com/logos/corpay-inc-logo-1200x675.jpg?v=20240412141104&w=240&h=240&zc=2,MarketBeat News,en,"{'Persons': ['Ben'], 'Organizations': ['NYSE', 'Morgan Stanley'], 'Locations': []}","[('corpay', 0.557), ('corpay nyse', 0.5442), ('nyse cpay', 0.5403), ('report price', 0.4721), ('price objective', 0.469)]","['Corpay (NYSE:CPAY – Get Free Report) had its price objective raised by research analysts at Morgan Stanley from $350.00 to $380.00 in a research report issued to clients and investors on Thursday,Ben… [+5088 chars]']","{'Source': 'ETF Daily News', 'Published Date': '2025-02-08T09:42:57Z', 'Keywords': [('corpay', 0.557), ('corpay nyse', 0.5442), ('nyse cpay', 0.5403), ('report price', 0.4721), ('price objective', 0.469)], 'Entities': {'Persons': ['Ben'], 'Organizations': ['NYSE', 'Morgan Stanley'], 'Locations': []}}"
enova international nyseenva price target raised to 12900,enova international nyseenva – free report had its price target increased by btig research from 12200 to 12900 in a research report sent to investors on wednesdaybenzinga reports btig,enova international nyseenva – free report had its price target increased by btig research from 12200 to 12900 in a research report sent to investors on wednesdaybenzinga reports btig research currently has a buy rating on the credit services,https://www.etfdailynews.com/2025/02/08/enova-international-nyseenva-price-target-raised-to-129-00/,ETF Daily News,2025-02-08T09:40:52Z,https://www.americanbankingnews.com/wp-content/timthumb/timthumb.php?src=https://www.marketbeat.com/logos/enova-international-inc-logo.png?v=20240515085242&w=240&h=240&zc=2,MarketBeat News,en,"{'Persons': ['Benzinga', 'BTIG Resear'], 'Organizations': ['Enova International', 'BTIG Research'], 'Locations': []}","[('increased btig', 0.5681), ('btig resear', 0.5474), ('btig research', 0.5412), ('btig', 0.4822), ('enova international', 0.4804)]","['Enova International (NYSE:ENVA – Free Report) had its price target increased by BTIG Research from $122.00 to $129.00 in a research report sent to investors on Wednesday,Benzinga reports. BTIG Resear… [+4924 chars]']","{'Source': 'ETF Daily News', 'Published Date': '2025-02-08T09:40:52Z', 'Keywords': [('increased btig', 0.5681), ('btig resear', 0.5474), ('btig research', 0.5412), ('btig', 0.4822), ('enova international', 0.4804)], 'Entities': {'Persons': ['Benzinga', 'BTIG Resear'], 'Organizations': ['Enova International', 'BTIG Research'], 'Locations': []}}"
abrdn plc sells 198071 shares of loma negra compañía industrial argentina sociedad anónima nyseloma,abrdn plc decreased its position in shares of loma negra compañía industrial argentina sociedad anónima nyseloma – free report by 158 during the 4th quarter according to its most recent filing,abrdn plc decreased its position in shares of loma negra compañía industrial argentina sociedad anónima nyseloma – free report by 158 during the 4th quarter according to its most recent filing with the securities and exchange commission sec the firm,https://www.etfdailynews.com/2025/02/08/abrdn-plc-sells-198071-shares-of-loma-negra-compania-industrial-argentina-sociedad-anonima-nyseloma/,ETF Daily News,2025-02-08T09:35:05Z,https://www.americanbankingnews.com/wp-content/timthumb/timthumb.php?src=https://www.marketbeat.com/logos/loma-negra-compania-industrial-argentina-sa-sponsored-adr-logo-1200x675.png&w=240&h=240&zc=2,MarketBeat News,en,"{'Persons': ['abrdn plc', 'Anónima'], 'Organizations': ['Loma Negra Compañía Industrial', 'NYSE'], 'Locations': ['Argentina']}","[('abrdn plc', 0.6057), ('anónima nyse', 0.5249), ('shares loma', 0.5184), ('abrdn', 0.5156), ('nyse loma', 0.4723)]","['abrdn plc decreased its position in shares of Loma Negra Compañía Industrial Argentina Sociedad Anónima (NYSE:LOMA – Free Report) by 15.8% during the 4th quarter, according to its most recent filing … [+4047 chars]']","{'Source': 'ETF Daily News', 'Published Date': '2025-02-08T09:35:05Z', 'Keywords': [('abrdn plc', 0.6057), ('anónima nyse', 0.5249), ('shares loma', 0.5184), ('abrdn', 0.5156), ('nyse loma', 0.4723)], 'Entities': {'Persons': ['abrdn plc', 'Anónima'], 'Organizations': ['Loma Negra Compañía Industrial', 'NYSE'], 'Locations': ['Argentina']}}"
alpha omega wealth management llc sells 330 shares of jpmorgan chase  co nysejpm,alpha omega wealth management llc reduced its stake in shares of jpmorgan chase amp co nysejpm by 08 during the 4th quarter holdingschannel reports the firm owned 38687 shares of the,alpha omega wealth management llc reduced its stake in shares of jpmorgan chase  co nysejpm by 08 during the 4th quarter holdingschannel reports the firm owned 38687 shares of the financial services provider’s stock after selling 330 shares during,https://www.etfdailynews.com/2025/02/08/alpha-omega-wealth-management-llc-sells-330-shares-of-jpmorgan-chase-co-nysejpm/,ETF Daily News,2025-02-08T09:35:04Z,https://www.americanbankingnews.com/wp-content/timthumb/timthumb.php?src=https://www.marketbeat.com/logos/jpmorgan-chase--co-logo-1200x675.png?v=20221020142040&w=240&h=240&zc=2,MarketBeat News,en,"{'Persons': [], 'Organizations': ['JPMorgan Chase &', 'Co. (', 'NYSE', 'JPM', 'HoldingsChannel'], 'Locations': []}","[('shares jpmorgan', 0.6094), ('jpmorgan chase', 0.5976), ('nyse jpm', 0.5758), ('jpmorgan', 0.5176), ('shares finan', 0.4929)]","['Alpha Omega Wealth Management LLC reduced its stake in shares of JPMorgan Chase &amp; Co. (NYSE:JPM) by 0.8% during the 4th quarter, HoldingsChannel reports. The firm owned 38,687 shares of the finan… [+6627 chars]']","{'Source': 'ETF Daily News', 'Published Date': '2025-02-08T09:35:04Z', 'Keywords': [('shares jpmorgan', 0.6094), ('jpmorgan chase', 0.5976), ('nyse jpm', 0.5758), ('jpmorgan', 0.5176), ('shares finan', 0.4929)], 'Entities': {'Persons': [], 'Organizations': ['JPMorgan Chase &', 'Co. (', 'NYSE', 'JPM', 'HoldingsChannel'], 'Locations': []}}"
james j burns  company llc lowers position in tesla inc nasdaqtsla,james j burns amp company llc cut its stake in tesla inc nasdaqtsla – free report by 25 in the 4th quarter according to the company in its most recent disclosure with the securities amp,james j burns  company llc cut its stake in tesla inc nasdaqtsla – free report by 25 in the 4th quarter according to the company in its most recent disclosure with the securities  exchange commission the fund owned 10209 shares of the electric,https://www.etfdailynews.com/2025/02/08/james-j-burns-company-llc-lowers-position-in-tesla-inc-nasdaqtsla/,ETF Daily News,2025-02-08T09:57:03Z,https://www.americanbankingnews.com/wp-content/timthumb/timthumb.php?src=https://www.marketbeat.com/logos/tesla-inc-logo-1200x675.png?v=20221020135629&w=240&h=240&zc=2,MarketBeat News,en,"{'Persons': ['James J. Burns &'], 'Organizations': ['LLC', 'Tesla, Inc.', 'the Securities &amp'], 'Locations': []}","[('stake tesla', 0.6411), ('tesla nasdaq', 0.579), ('tesla', 0.5129), ('nasdaq tsla', 0.4464), ('james burns', 0.3851)]","['James J. Burns &amp; Company LLC cut its stake in Tesla, Inc. (NASDAQ:TSLA – Free Report) by 2.5% in the 4th quarter, according to the company in its most recent disclosure with the Securities &amp; … [+6177 chars]']","{'Source': 'ETF Daily News', 'Published Date': '2025-02-08T09:57:03Z', 'Keywords': [('stake tesla', 0.6411), ('tesla nasdaq', 0.579), ('tesla', 0.5129), ('nasdaq tsla', 0.4464), ('james burns', 0.3851)], 'Entities': {'Persons': ['James J. Burns &'], 'Organizations': ['LLC', 'Tesla, Inc.', 'the Securities &amp'], 'Locations': []}}"
abrdn plc purchases 23078 shares of udr inc nyseudr,abrdn plc increased its holdings in shares of udr inc nyseudr – free report by 118 in the 4th quarter holdingschannelcom reports the firm owned 219193 shares of the real estate investment,abrdn plc increased its holdings in shares of udr inc nyseudr – free report by 118 in the 4th quarter holdingschannelcom reports the firm owned 219193 shares of the real estate investment trust’s stock after acquiring an additional 23078 shares,https://www.etfdailynews.com/2025/02/08/abrdn-plc-purchases-23078-shares-of-udr-inc-nyseudr/,ETF Daily News,2025-02-08T09:57:00Z,https://www.americanbankingnews.com/wp-content/timthumb/timthumb.php?src=https://www.marketbeat.com/logos/udr-inc-logo-1200x675.png?v=20240108101314&w=240&h=240&zc=2,MarketBeat News,en,"{'Persons': [], 'Organizations': ['abrdn plc', 'UDR, Inc. (', 'NYSE', 'HoldingsChannel.com'], 'Locations': []}","[('shares udr', 0.6457), ('udr nyse', 0.607), ('nyse udr', 0.6015), ('abrdn plc', 0.5807), ('holdings shares', 0.5185)]","['abrdn plc increased its holdings in shares of UDR, Inc. (NYSE:UDR – Free Report) by 11.8% in the 4th quarter, HoldingsChannel.com reports. The firm owned 219,193 shares of the real estate investment … [+4492 chars]']","{'Source': 'ETF Daily News', 'Published Date': '2025-02-08T09:57:00Z', 'Keywords': [('shares udr', 0.6457), ('udr nyse', 0.607), ('nyse udr', 0.6015), ('abrdn plc', 0.5807), ('holdings shares', 0.5185)], 'Entities': {'Persons': [], 'Organizations': ['abrdn plc', 'UDR, Inc. (', 'NYSE', 'HoldingsChannel.com'], 'Locations': []}}"
how a data engineer returned 483 trading on bitcoins value inside a triple tax benefit account,the financial independence retire early or fire movement was brandon frenchaks introduction to investing he was a few years out of college looking for ways to make his paycheck go further,he returned 483 trading on the gap between a stocks net asset value and share price using a taxfree account,https://www.businessinsider.com/how-to-trade-bitcoin-triple-tax-benefit-account-hsa-trader-2025-2,Business Insider,2025-02-08T09:55:01Z,https://i.insider.com/67a52ceeeb4be2fff9a3db12?width=1200&format=jpeg,lmaidan@businessinsider.com (Laila Maidan),en,"{'Persons': ['Retire Early', ""Brandon Frenchak's""], 'Organizations': ['The Financial Independence', 'FIRE'], 'Locations': []}","[('independence retire', 0.518), ('financial independence', 0.4958), ('introduction investing', 0.4873), ('investing', 0.4837), ('investing years', 0.4661)]","[""The Financial Independence, Retire Early (or FIRE) movement was Brandon Frenchak's introduction to investing. He was a few years out of college, looking for ways to make his paycheck go further, whe… [+5986 chars]""]","{'Source': 'Business Insider', 'Published Date': '2025-02-08T09:55:01Z', 'Keywords': [('independence retire', 0.518), ('financial independence', 0.4958), ('introduction investing', 0.4873), ('investing', 0.4837), ('investing years', 0.4661)], 'Entities': {'Persons': ['Retire Early', ""Brandon Frenchak's""], 'Organizations': ['The Financial Independence', 'FIRE'], 'Locations': []}}"
palantir stock’s great week and a microstrategy security to buy now  barrons,the fine print the following comments are owned by whoever posted them we are not responsible for them in any way,palantir stock’s great week and a microstrategy security to buy nowbarrons 1 ai stock to buy before it soars 335 to 1 trillion according to a wall street analystyahoo finance stock market investing this ibd rating helped investors judge palantirs,https://slashdot.org/firehose.pl?op=view&amp;id=176155915,Slashdot.org,2025-02-08T09:52:19Z,,feedfeeder,en,"{'Persons': [], 'Organizations': [], 'Locations': []}","[('comments owned', 0.7037), ('following comments', 0.4778), ('owned posted', 0.4581), ('owned', 0.4413), ('posted responsible', 0.4408)]",['The Fine Print: The following comments are owned by whoever posted them. We are not responsible for them in any way.'],"{'Source': 'Slashdot.org', 'Published Date': '2025-02-08T09:52:19Z', 'Keywords': [('comments owned', 0.7037), ('following comments', 0.4778), ('owned posted', 0.4581), ('owned', 0.4413), ('posted responsible', 0.4408)], 'Entities': {'Persons': [], 'Organizations': [], 'Locations': []}}"
